EVT_NAME,EVT_FUEL_N,EVT_LF,EVT_PHYS,EVT_GP_N,SAF_SRM,EVT_ORDER,EVT_CLASS,EVT_SBCLS,COUNT
Eastern Warm Temperate Developed Ruderal Mixed Forested Wetland,Dtm Developed Ruderal Deciduous-Evergreen Forested Wetland,Tree,Developed,Developed-Wetland Mixed Forest,LF 20: Developed,Tree-dominated,Open tree canopy,Mixed evergreen-deciduous open tree canopy,4282
Eastern Warm Temperate Developed Ruderal Shrub Wetland,Dsh Developed Ruderal Shrub Wetland,Shrub,Developed,Developed-Wetland Shrubland,LF 20: Developed,Shrub-dominated,Shrubland,Mixed evergreen-deciduous shrubland,10
Eastern Warm Temperate Developed Ruderal Herbaceous Wetland,Dgr Developed Ruderal Herbaceous Wetland,Herb,Developed,Developed-Wetland Herbaceous,LF 20: Developed,Herbaceous / Nonvascular-dominated,Herbaceous - grassland,Perennial graminoid,709
Western Cool Temperate Orchard,Dab Orchard,Tree,Agricultural,Agricultural-Orchard,LF 80: Agriculture,Tree-dominated,Open tree canopy,Deciduous open tree canopy,131
Western Cool Temperate Vineyard,Da Vineyard,Agriculture,Agricultural,Agricultural-Vineyard,LF 80: Agriculture,Shrub-dominated,Shrubland,Mixed evergreen-deciduous shrubland,18
Western Cool Temperate Bush fruit and berries,Dab Bush Fruit and Berries,Shrub,Agricultural,Agricultural-Bush fruit and berries,LF 80: Agriculture,Shrub-dominated,Shrubland,Mixed evergreen-deciduous shrubland,49
Western Cool Temperate Row Crop - Close Grown Crop,Da Row Crop - Close Grown Crop,Agriculture,Agricultural,Agricultural-Row Crop-Close Grown Crop,LF 80: Agriculture,Herbaceous / Nonvascular-dominated,Herbaceous - grassland,Annual Graminoid/Forb,4
Western Cool Temperate Row Crop,Da Row Crop,Agriculture,Agricultural,Agricultural-Row Crop,LF 80: Agriculture,Herbaceous / Nonvascular-dominated,Herbaceous - grassland,Annual Graminoid/Forb,21614
Western Cool Temperate Close Grown Crop,Da Close Grown Crop,Agriculture,Agricultural,Agricultural-Close Grown Crop,LF 80: Agriculture,Herbaceous / Nonvascular-dominated,Herbaceous - grassland,Annual Graminoid/Forb,92653
Western Cool Temperate Fallow/Idle Cropland,Dab Fallow/Idle Cropland,Herb,Agricultural,Agricultural-Fallow/Idle Cropland,LF 80: Agriculture,Herbaceous / Nonvascular-dominated,Herbaceous - grassland,Annual Graminoid/Forb,17308
Western Cool Temperate Pasture and Hayland,Dab Pasture and Hayland,Herb,Agricultural,Agricultural-Pasture and Hayland,LF 80: Agriculture,Herbaceous / Nonvascular-dominated,Herbaceous - grassland,Annual Graminoid/Forb,208514
Western Cool Temperate Wheat,Da Wheat,Agriculture,Agricultural,Agricultural-Wheat,LF 80: Agriculture,Herbaceous / Nonvascular-dominated,Herbaceous - grassland,Annual Graminoid/Forb,16863
Eastern Cool Temperate Orchard,Dab Orchard,Tree,Agricultural,Agricultural-Orchard,LF 80: Agriculture,Tree-dominated,Open tree canopy,Deciduous open tree canopy,94
Eastern Cool Temperate Vineyard,Da Vineyard,Agriculture,Agricultural,Agricultural-Vineyard,LF 80: Agriculture,Shrub-dominated,Shrubland,Mixed evergreen-deciduous shrubland,243
Eastern Cool Temperate Bush fruit and berries,Dab Bush Fruit and Berries,Shrub,Agricultural,Agricultural-Bush fruit and berries,LF 80: Agriculture,Shrub-dominated,Shrubland,Mixed evergreen-deciduous shrubland,134
Eastern Cool Temperate Row Crop - Close Grown Crop,Da Row Crop - Close Grown Crop,Agriculture,Agricultural,Agricultural-Row Crop-Close Grown Crop,LF 80: Agriculture,Herbaceous / Nonvascular-dominated,Herbaceous - grassland,Annual Graminoid/Forb,607
Eastern Cool Temperate Row Crop,Da Row Crop,Agriculture,Agricultural,Agricultural-Row Crop,LF 80: Agriculture,Herbaceous / Nonvascular-dominated,Herbaceous - grassland,Annual Graminoid/Forb,89137
Eastern Cool Temperate Close Grown Crop,Da Close Grown Crop,Agriculture,Agricultural,Agricultural-Close Grown Crop,LF 80: Agriculture,Herbaceous / Nonvascular-dominated,Herbaceous - grassland,Annual Graminoid/Forb,21422
Eastern Cool Temperate Fallow/Idle Cropland,Dab Fallow/Idle Cropland,Herb,Agricultural,Agricultural-Fallow/Idle Cropland,LF 80: Agriculture,Herbaceous / Nonvascular-dominated,Herbaceous - grassland,Annual Graminoid/Forb,4438
Eastern Cool Temperate Pasture and Hayland,Dab Pasture and Hayland,Herb,Agricultural,Agricultural-Pasture and Hayland,LF 80: Agriculture,Herbaceous / Nonvascular-dominated,Herbaceous - grassland,Annual Graminoid/Forb,139510
Eastern Cool Temperate Wheat,Da Wheat,Agriculture,Agricultural,Agricultural-Wheat,LF 80: Agriculture,Herbaceous / Nonvascular-dominated,Herbaceous - grassland,Annual Graminoid/Forb,2260
Western Warm Temperate Orchard,Dab Orchard,Tree,Agricultural,Agricultural-Orchard,LF 80: Agriculture,Tree-dominated,Open tree canopy,Deciduous open tree canopy,6085
Western Warm Temperate Vineyard,Da Vineyard,Agriculture,Agricultural,Agricultural-Vineyard,LF 80: Agriculture,Shrub-dominated,Shrubland,Mixed evergreen-deciduous shrubland,251
Western Warm Temperate Row Crop - Close Grown Crop,Da Row Crop - Close Grown Crop,Agriculture,Agricultural,Agricultural-Row Crop-Close Grown Crop,LF 80: Agriculture,Herbaceous / Nonvascular-dominated,Herbaceous - grassland,Annual Graminoid/Forb,3
Western Warm Temperate Row Crop,Da Row Crop,Agriculture,Agricultural,Agricultural-Row Crop,LF 80: Agriculture,Herbaceous / Nonvascular-dominated,Herbaceous - grassland,Annual Graminoid/Forb,51236
Western Warm Temperate Close Grown Crop,Da Close Grown Crop,Agriculture,Agricultural,Agricultural-Close Grown Crop,LF 80: Agriculture,Herbaceous / Nonvascular-dominated,Herbaceous - grassland,Annual Graminoid/Forb,4482
Western Warm Temperate Fallow/Idle Cropland,Dab Fallow/Idle Cropland,Herb,Agricultural,Agricultural-Fallow/Idle Cropland,LF 80: Agriculture,Herbaceous / Nonvascular-dominated,Herbaceous - grassland,Annual Graminoid/Forb,13459
Western Warm Temperate Pasture and Hayland,Dab Pasture and Hayland,Herb,Agricultural,Agricultural-Pasture and Hayland,LF 80: Agriculture,Herbaceous / Nonvascular-dominated,Herbaceous - grassland,Annual Graminoid/Forb,39820
Western Warm Temperate Wheat,Da Wheat,Agriculture,Agricultural,Agricultural-Wheat,LF 80: Agriculture,Herbaceous / Nonvascular-dominated,Herbaceous - grassland,Annual Graminoid/Forb,6712
Western Warm Temperate Aquaculture,Da Aquaculture,Agriculture,Agricultural,Agricultual-Aquaculture,LF 80: Agriculture,Herbaceous / Nonvascular-dominated,Herbaceous - grassland,Annual Graminoid/Forb,47
Eastern Warm Temperate Orchard,Dab Orchard,Tree,Agricultural,Agricultural-Orchard,LF 80: Agriculture,Tree-dominated,Open tree canopy,Deciduous open tree canopy,5360
Eastern Warm Temperate Bush fruit and berries,Dab Bush Fruit and Berries,Shrub,Agricultural,Agricultural-Bush fruit and berries,LF 80: Agriculture,Shrub-dominated,Shrubland,Mixed evergreen-deciduous shrubland,3
Eastern Warm Temperate Row Crop - Close Grown Crop,Da Row Crop - Close Grown Crop,Agriculture,Agricultural,Agricultural-Row Crop-Close Grown Crop,LF 80: Agriculture,Herbaceous / Nonvascular-dominated,Herbaceous - grassland,Annual Graminoid/Forb,9
Eastern Warm Temperate Row Crop,Da Row Crop,Agriculture,Agricultural,Agricultural-Row Crop,LF 80: Agriculture,Herbaceous / Nonvascular-dominated,Herbaceous - grassland,Annual Graminoid/Forb,3022
Eastern Warm Temperate Close Grown Crop,Da Close Grown Crop,Agriculture,Agricultural,Agricultural-Close Grown Crop,LF 80: Agriculture,Herbaceous / Nonvascular-dominated,Herbaceous - grassland,Annual Graminoid/Forb,846
Eastern Warm Temperate Fallow/Idle Cropland,Dab Fallow/Idle Cropland,Herb,Agricultural,Agricultural-Fallow/Idle Cropland,LF 80: Agriculture,Herbaceous / Nonvascular-dominated,Herbaceous - grassland,Annual Graminoid/Forb,4605
Eastern Warm Temperate Pasture and Hayland,Dab Pasture and Hayland,Herb,Agricultural,Agricultural-Pasture and Hayland,LF 80: Agriculture,Herbaceous / Nonvascular-dominated,Herbaceous - grassland,Annual Graminoid/Forb,17470
Eastern Warm Temperate Wheat,Da Wheat,Agriculture,Agricultural,Agricultural-Wheat,LF 80: Agriculture,Herbaceous / Nonvascular-dominated,Herbaceous - grassland,Annual Graminoid/Forb,16
Eastern Warm Temperate Aquaculture,Da Aquaculture,Agriculture,Agricultural,Agricultual-Aquaculture,LF 80: Agriculture,Herbaceous / Nonvascular-dominated,Herbaceous - grassland,Annual Graminoid/Forb,267
Colorado Plateau Mixed Bedrock Canyon and Tableland,Sps Inter-Mountain Basins Sparsely Vegetated Systems,Sparse,Sparsely Vegetated,Sparse Vegetation,LF 33: Sparsely Vegetated,No Dominant Lifeform,Sparsely vegetated,Sparsely vegetated,3768
Columbia Basin Foothill Riparian Woodland,Tr Inter-Mountain Basins Montane Riparian Systems,Tree,Riparian,Western Riparian Woodland and Shrubland,SAF 235: Cottonwood-Willow,Tree-dominated,Open tree canopy,Mixed evergreen-deciduous open tree canopy,446
Great Basin Foothill and Lower Montane Riparian Woodland,Tr Inter-Mountain Basins Montane Riparian Systems,Tree,Riparian,Western Riparian Woodland and Shrubland,SAF 235: Cottonwood-Willow,Tree-dominated,Open tree canopy,Mixed evergreen-deciduous open tree canopy,626
Inter-Mountain Basins Active and Stabilized Dune,Sps Inter-Mountain Basins Sparsely Vegetated Systems,Sparse,Sparsely Vegetated,Sparse Vegetation,LF 33: Sparsely Vegetated,No Dominant Lifeform,Sparsely vegetated,Sparsely vegetated,13349
Inter-Mountain Basins Alkaline Closed Depression,He Inter-Mountain Basins Alkaline Closed Depression,Herb,Riparian,Depressional Wetland,LF 56: Western Herbaceous Wetland,Herbaceous / Nonvascular-dominated,Herbaceous - grassland,Perennial graminoid grassland,2978
Inter-Mountain Basins Cliff and Canyon,Sps Inter-Mountain Basins Sparsely Vegetated Systems,Sparse,Sparsely Vegetated,Sparse Vegetation,LF 33: Sparsely Vegetated,No Dominant Lifeform,Sparsely vegetated,Sparsely vegetated,8371
Inter-Mountain Basins Playa,Sps Inter-Mountain Basins Sparsely Vegetated Systems,Sparse,Sparsely Vegetated,Sparse Vegetation,LF 33: Sparsely Vegetated,No Dominant Lifeform,Sparsely vegetated,Sparsely vegetated,3274
Inter-Mountain Basins Shale Badland,Sps Inter-Mountain Basins Sparsely Vegetated Systems,Sparse,Sparsely Vegetated,Sparse Vegetation,LF 33: Sparsely Vegetated,No Dominant Lifeform,Sparsely vegetated,Sparsely vegetated,15379
Inter-Mountain Basins Wash,Sps Inter-Mountain Basins Sparsely Vegetated Systems,Sparse,Sparsely Vegetated,Sparse Vegetation,LF 33: Sparsely Vegetated,No Dominant Lifeform,Sparsely vegetated,Sparsely vegetated,162
North American Arid West Emergent Marsh,He North American Arid West Emergent Marsh,Herb,Riparian,Freshwater Marsh,LF 56: Western Herbaceous Wetland,Herbaceous / Nonvascular-dominated,Herbaceous - grassland,Perennial graminoid grassland,123836
Northern Rocky Mountain Lower Montane Riparian Woodland,Tr Rocky Mountain Montane Riparian Systems,Tree,Riparian,Western Riparian Woodland and Shrubland,SAF 235: Cottonwood-Willow,Tree-dominated,Open tree canopy,Mixed evergreen-deciduous open tree canopy,20140
Northwestern Great Plains Floodplain Forest and Woodland,Tr Western Great Plains Floodplain Systems,Tree,Riparian,Western Riparian Woodland and Shrubland,LF 42: Great Plains Riparian,Tree-dominated,Open tree canopy,Deciduous open tree canopy,4803
Northwestern Great Plains Riparian Forest,Tr Western Great Plains Floodplain Systems,Tree,Riparian,Western Riparian Woodland and Shrubland,LF 42: Great Plains Riparian,Tree-dominated,Open tree canopy,Deciduous open tree canopy,22374
Rocky Mountain Alpine Bedrock and Scree,Sps Rocky Mountain Alpine/Montane Sparsely Vegetated Systems,Sparse,Sparsely Vegetated,Sparse Vegetation,LF 33: Sparsely Vegetated,No Dominant Lifeform,Sparsely vegetated,Sparsely vegetated,12298
Rocky Mountain Alpine-Montane Wet Meadow,He Rocky Mountain Alpine-Montane Wet Meadow,Herb,Riparian,Western Herbaceous Wetland,SRM 422: Riparian,Herbaceous / Nonvascular-dominated,Herbaceous - grassland,Perennial graminoid grassland,98920
Rocky Mountain Cliff Canyon and Massive Bedrock,Sps Rocky Mountain Alpine/Montane Sparsely Vegetated Systems,Sparse,Sparsely Vegetated,Sparse Vegetation,LF 33: Sparsely Vegetated,No Dominant Lifeform,Sparsely vegetated,Sparsely vegetated,5309
Rocky Mountain Lower Montane-Foothill Riparian Woodland,Tr Rocky Mountain Montane Riparian Systems,Tree,Riparian,Western Riparian Woodland and Shrubland,SAF 235: Cottonwood-Willow,Tree-dominated,Open tree canopy,Mixed evergreen-deciduous open tree canopy,31291
Rocky Mountain Subalpine-Montane Riparian Shrubland,Tr Rocky Mountain Subalpine/Upper Montane Riparian Systems,Shrub,Riparian,Western Riparian Woodland and Shrubland,SRM 422: Riparian,Shrub-dominated,Shrubland,Mixed evergreen-deciduous shrubland,13406
Rocky Mountain Subalpine-Montane Riparian Woodland,Tr Rocky Mountain Subalpine/Upper Montane Riparian Systems,Tree,Riparian,Western Riparian Woodland and Shrubland,SRM 422: Riparian,Tree-dominated,Open tree canopy,Mixed evergreen-deciduous open tree canopy,8213
Western Great Plains Badlands,Sps Western Great Plains Sparsely Vegetated Systems,Sparse,Sparsely Vegetated,Sparse Vegetation,LF 33: Sparsely Vegetated,No Dominant Lifeform,Sparsely vegetated,Sparsely vegetated,37734
Western Great Plains Cliff and Outcrop,Sps Western Great Plains Sparsely Vegetated Systems,Sparse,Sparsely Vegetated,Sparse Vegetation,LF 33: Sparsely Vegetated,No Dominant Lifeform,Sparsely vegetated,Sparsely vegetated,8815
Western Great Plains Closed Depression Wetland,He Western Great Plains Depressional Wetland Systems,Herb,Riparian,Depressional Wetland,SRM 601: Bluestem Prairie,Herbaceous / Nonvascular-dominated,Herbaceous - grassland,Perennial graminoid grassland,1295
Western Great Plains Floodplain Forest and Woodland,Tr Western Great Plains Floodplain Systems,Tree,Riparian,Western Riparian Woodland and Shrubland,LF 42: Great Plains Riparian,Tree-dominated,Open tree canopy,Deciduous open tree canopy,6707
Western Great Plains Open Freshwater Depression Wetland,He Western Great Plains Depressional Wetland Systems,Herb,Riparian,Depressional Wetland,SRM 601: Bluestem Prairie,Herbaceous / Nonvascular-dominated,Herbaceous - grassland,Perennial graminoid grassland,3044
Western Great Plains Riparian Woodland,Tr Western Great Plains Floodplain Systems,Tree,Riparian,Western Riparian Woodland and Shrubland,LF 42: Great Plains Riparian,Tree-dominated,Open tree canopy,Deciduous open tree canopy,4230
Western Great Plains Saline Depression Wetland,He Western Great Plains Depressional Wetland Systems,Herb,Riparian,Depressional Wetland,SRM 601: Bluestem Prairie,Herbaceous / Nonvascular-dominated,Herbaceous - grassland,Perennial graminoid grassland,929
Columbia Plateau Silver Sagebrush Seasonally Flooded Shrub-Steppe,Tr Inter-Mountain Basins Montane Riparian Systems,Shrub,Riparian,Western Riparian Woodland and Shrubland,SRM 422: Riparian,Shrub-dominated,Shrubland,Mixed evergreen-deciduous shrubland,226
Inter-Mountain Basins Volcanic Rock and Cinder Land,Sps Inter-Mountain Basins Sparsely Vegetated Systems,Sparse,Sparsely Vegetated,Sparse Vegetation,LF 33: Sparsely Vegetated,No Dominant Lifeform,Sparsely vegetated,Sparsely vegetated,1
North American Warm Desert Riparian Woodland,Tr North American Warm Desert Riparian Systems,Tree,Riparian,Western Riparian Woodland and Shrubland,SRM 203: Riparian Woodland,Tree-dominated,Open tree canopy,Deciduous open tree canopy,3727
North American Warm Desert Lower Montane Riparian Woodland,Tr North American Warm Desert Riparian Systems,Tree,Riparian,Western Riparian Woodland and Shrubland,SRM 203: Riparian Woodland,Tree-dominated,Open tree canopy,Deciduous open tree canopy,17057
Acadian Coastal Salt Marsh,He Acadian Salt Marsh and Estuary Systems,Herb,Riparian,Atlantic Coastal Marsh,LF 44: Laurentian-Acadian Herbaceous Wetland,Herbaceous / Nonvascular-dominated,Herbaceous - grassland,Perennial graminoid grassland,2239
Acadian Estuary Marsh,He Acadian Salt Marsh and Estuary Systems,Herb,Riparian,Atlantic Coastal Marsh,LF 44: Laurentian-Acadian Herbaceous Wetland,Herbaceous / Nonvascular-dominated,Herbaceous - grassland,Perennial graminoid grassland,538
Acadian Maritime Bog,Tr Boreal Acidic Peatland Systems,Shrub,Riparian,Peatland Forests,SAF 13: Black Spruce-Tamarack,Shrub-dominated,Shrubland,Mixed evergreen-deciduous shrubland,772
Acadian-Appalachian Conifer Seepage Forest,Tr Laurentian-Acadian Swamp Systems,Tree,Riparian,Atlantic Swamp Forests,SAF 33: Red Spruce-Balsam Fir,Tree-dominated,Open tree canopy,Evergreen open tree canopy,24743
Acadian-North Atlantic Rocky Coast,Sps Laurentian-Acadian Sparsely Vegetated Systems,Sparse,Sparsely Vegetated,Sparse Vegetation,LF 33: Sparsely Vegetated,No Dominant Lifeform,Sparsely vegetated,Sparsely vegetated,425
Atlantic Coastal Plain Blackwater Stream Floodplain Forest,Tr Gulf and Atlantic Coastal Plain Small Stream Riparian Systems,Tree,Riparian,Eastern Small Stream Riparian Forests,SAF 92: Sweetgum-Willow Oak,Tree-dominated,Open tree canopy,Mixed evergreen-deciduous open tree canopy,9860
Atlantic Coastal Plain Brownwater Stream Floodplain Forest,Tr Gulf and Atlantic Coastal Plain Small Stream Riparian Systems,Tree,Riparian,Eastern Small Stream Riparian Forests,SAF 92: Sweetgum-Willow Oak,Tree-dominated,Open tree canopy,Mixed evergreen-deciduous open tree canopy,336
Atlantic Coastal Plain Embayed Region Tidal Freshwater Marsh,He Gulf and Atlantic Coastal Plain Tidal Marsh Systems,Herb,Riparian,Atlantic Coastal Marsh,LF 50: Tidal Flats and Marshes,Herbaceous / Nonvascular-dominated,Herbaceous - grassland,Perennial graminoid grassland,256
Atlantic Coastal Plain Embayed Region Tidal Salt and Brackish Marsh,He Gulf and Atlantic Coastal Plain Tidal Marsh Systems,Herb,Riparian,Atlantic Coastal Marsh,LF 50: Tidal Flats and Marshes,Herbaceous / Nonvascular-dominated,Herbaceous - grassland,Perennial graminoid grassland,3390
Atlantic Coastal Plain Northern Bog,Tr Atlantic Coastal Plain Northern Bog,Shrub,Riparian,Shrub and Herbaceous Peatlands,LF 71: Shrub and Herbaceous Peatlands,Shrub-dominated,Shrubland,Deciduous shrubland,214
Atlantic Coastal Plain Small Blackwater River Floodplain Forest,Tr Gulf and Atlantic Coastal Plain Floodplain Systems,Tree,Riparian,Eastern Floodplain Forests,SAF 92: Sweetgum-Willow Oak,Tree-dominated,Open tree canopy,Mixed evergreen-deciduous open tree canopy,22647
Atlantic Coastal Plain Small Brownwater River Floodplain Forest,Tr Gulf and Atlantic Coastal Plain Floodplain Systems,Tree,Riparian,Eastern Floodplain Forests,SAF 92: Sweetgum-Willow Oak,Tree-dominated,Open tree canopy,Mixed evergreen-deciduous open tree canopy,9688
Boreal-Laurentian Bog,Tr Boreal Acidic Peatland Systems,Shrub,Riparian,Peatland Forests,SAF 13: Black Spruce-Tamarack,Shrub-dominated,Shrubland,Mixed evergreen-deciduous shrubland,18538
Boreal-Laurentian Conifer Acidic Swamp and Treed Poor Fen,Tr Boreal Acidic Peatland Systems,Tree,Riparian,Peatland Forests,SAF 13: Black Spruce-Tamarack,Tree-dominated,Open tree canopy,Evergreen open tree canopy,80307
Boreal-Laurentian-Acadian Acidic Basin Fen,Sh Laurentian-Acadian Shrub-Herbaceous Wetland Systems,Shrub,Riparian,Inland Marshes and Prairies,LF 44: Laurentian-Acadian Herbaceous Wetland,Shrub-dominated,Shrubland,Mixed evergreen-deciduous shrubland,25348
Central Appalachian River Floodplain Forest,Tr Central Interior and Appalachian Floodplain Systems,Tree,Riparian,Eastern Floodplain Forests,SAF 61: River Birch-Sycamore,Tree-dominated,Open tree canopy,Mixed evergreen-deciduous open tree canopy,2145
Central Appalachian Stream and Riparian Woodland,Tr Central Interior and Appalachian Riparian Systems,Tree,Riparian,Eastern Small Stream Riparian Forests,SAF 61: River Birch-Sycamore,Tree-dominated,Open tree canopy,Mixed evergreen-deciduous open tree canopy,10814
Central California Coast Ranges Cliff and Canyon,Sps Mediterranean California Sparsely Vegetated Systems,Sparse,Sparsely Vegetated,Sparse Vegetation,LF 33: Sparsely Vegetated,No Dominant Lifeform,Sparsely vegetated,Sparsely vegetated,4413
Central Florida Wet Prairie and Herbaceous Seep,He Central Florida Wet Prairie and Herbaceous Seep,Herb,Riparian,Inland Marshes and Prairies,SRM 819: Freshwater Marsh and Ponds,Herbaceous / Nonvascular-dominated,Herbaceous - grassland,Perennial graminoid grassland,788
Central Interior Acidic Cliff and Talus,Sps Central Interior and Appalachian Sparsely Vegetated Systems,Sparse,Sparsely Vegetated,Sparse Vegetation,LF 33: Sparsely Vegetated,No Dominant Lifeform,Sparsely vegetated,Sparsely vegetated,33
Central Interior Highlands and Appalachian Sinkhole and Depression Pond,Tr Central Interior and Appalachian Swamp Systems,Tree,Riparian,Atlantic Swamp Forests,SAF 61: River Birch-Sycamore,Tree-dominated,Open tree canopy,Mixed evergreen-deciduous open tree canopy,25
Central Texas Coastal Prairie Riparian Forest,Tr Gulf and Atlantic Coastal Plain Small Stream Riparian Systems,Tree,Riparian,Eastern Small Stream Riparian Forests,SAF 92: Sweetgum-Willow Oak,Tree-dominated,Open tree canopy,Mixed evergreen-deciduous open tree canopy,816
Central Texas Coastal Prairie River Floodplain Forest,Tr Gulf and Atlantic Coastal Plain Floodplain Systems,Tree,Riparian,Eastern Floodplain Forests,SAF 92: Sweetgum-Willow Oak,Tree-dominated,Open tree canopy,Mixed evergreen-deciduous open tree canopy,54
Columbia Bottomlands Forest and Woodland,Tr Gulf and Atlantic Coastal Plain Floodplain Systems,Tree,Riparian,Eastern Floodplain Forests,SAF 92: Sweetgum-Willow Oak,Tree-dominated,Open tree canopy,Deciduous open tree canopy,5997
East Gulf Coastal Plain Depression Pondshore,He East Gulf Coastal Plain Depression Pondshore,Herb,Riparian,Depressional Wetland,SRM 819: Freshwater Marsh and Ponds,Herbaceous / Nonvascular-dominated,Herbaceous - grassland,Perennial graminoid grassland,27
East Gulf Coastal Plain Freshwater Tidal Wooded Swamp,Tr Gulf and Atlantic Coastal Plain Swamp Systems,Tree,Riparian,Atlantic Swamp Forests,LF 46: Atlantic Coastal Plain Swamp,Tree-dominated,Open tree canopy,Mixed evergreen-deciduous open tree canopy,47
East Gulf Coastal Plain Large River Floodplain Forest,Tr Gulf and Atlantic Coastal Plain Floodplain Systems,Tree,Riparian,Eastern Floodplain Forests,SAF 92: Sweetgum-Willow Oak,Tree-dominated,Open tree canopy,Mixed evergreen-deciduous open tree canopy,42049
East Gulf Coastal Plain Northern Seepage Swamp,Tr Gulf and Atlantic Coastal Plain Swamp Systems,Tree,Riparian,Atlantic Swamp Forests,LF 46: Atlantic Coastal Plain Swamp,Tree-dominated,Open tree canopy,Mixed evergreen-deciduous open tree canopy,30
East Gulf Coastal Plain Small Stream and River Floodplain Forest,Tr Gulf and Atlantic Coastal Plain Small Stream Riparian Systems,Tree,Riparian,Eastern Small Stream Riparian Forests,SAF 92: Sweetgum-Willow Oak,Tree-dominated,Open tree canopy,Mixed evergreen-deciduous open tree canopy,18991
Laurentian-Acadian Sub-boreal Dry-Mesic Pine-Black Spruce Forest,Tr Boreal Jack Pine-Black Spruce Forest,Tree,Conifer,Jack Pine Forest,SAF 1: Jack Pine,Tree-dominated,Closed tree canopy,Evergreen closed tree canopy,705
Laurentian-Acadian Sub-boreal Mesic Balsam Fir-Spruce Forest,Tr Boreal White Spruce-Fir Forest,Tree,Conifer,Spruce-Fir-Hardwood Forest,SAF 5: Balsam Fir,Tree-dominated,Closed tree canopy,Evergreen closed tree canopy,32936
Edwards Plateau Cliff,Sps Western Great Plains Sparsely Vegetated Systems,Sparse,Sparsely Vegetated,Sparse Vegetation,LF 33: Sparsely Vegetated,No Dominant Lifeform,Sparsely vegetated,Sparsely vegetated,1578
Edwards Plateau Floodplain Terrace Forest and Woodland,Tr Edwards Plateau Floodplain Terrace,Tree,Riparian,Eastern Floodplain Forests,LF 42: Great Plains Riparian,Tree-dominated,Open tree canopy,Deciduous open tree canopy,1863
Florida Big Bend Fresh and Oligohaline Tidal Marsh,He Gulf and Atlantic Coastal Plain Tidal Marsh Systems,Herb,Riparian,Atlantic Coastal Marsh,SRM 818: Florida Salt Marsh,Herbaceous / Nonvascular-dominated,Herbaceous - grassland,Perennial graminoid grassland,341
Florida Big Bend Salt and Brackish Tidal Marsh,He Gulf and Atlantic Coastal Plain Tidal Marsh Systems,Herb,Riparian,Atlantic Coastal Marsh,SRM 818: Florida Salt Marsh,Herbaceous / Nonvascular-dominated,Herbaceous - grassland,Perennial graminoid grassland,778
Florida Panhandle Beach Vegetation,Sps Gulf and Atlantic Coastal Plain Sparsely Vegetated Systems,Sparse,Sparsely Vegetated,Sparse Vegetation,LF 33: Sparsely Vegetated,No Dominant Lifeform,Sparsely vegetated,Sparsely vegetated,386
Florida River Floodplain Marsh,He Florida River Floodplain Marsh,Herb,Riparian,Inland Marshes and Prairies,SRM 819: Freshwater Marsh and Ponds,Herbaceous / Nonvascular-dominated,Herbaceous - grassland,Perennial graminoid grassland,59
Great Lakes Acidic Rocky Shore and Cliff,Sps Laurentian-Acadian Sparsely Vegetated Systems,Sparse,Sparsely Vegetated,Sparse Vegetation,LF 33: Sparsely Vegetated,No Dominant Lifeform,Sparsely vegetated,Sparsely vegetated,20
Great Lakes Alkaline Rocky Shore and Cliff,Sps Laurentian-Acadian Sparsely Vegetated Systems,Sparse,Sparsely Vegetated,Sparse Vegetation,LF 33: Sparsely Vegetated,No Dominant Lifeform,Sparsely vegetated,Sparsely vegetated,55
Great Lakes Dune,Sps Laurentian-Acadian Sparsely Vegetated Systems,Sparse,Sparsely Vegetated,Sparse Vegetation,LF 33: Sparsely Vegetated,No Dominant Lifeform,Sparsely vegetated,Sparsely vegetated,674
Gulf Coast Chenier Plain Fresh and Oligohaline Tidal Marsh,Sh Gulf and Atlantic Coastal Plain Tidal Marsh Systems,Herb,Riparian,Atlantic Coastal Marsh,SRM 807: Gulf Coast Fresh Marsh,Herbaceous / Nonvascular-dominated,Herbaceous - grassland,Perennial graminoid grassland,3579
Gulf Coast Chenier Plain Salt and Brackish Tidal Marsh,Sh Gulf and Atlantic Coastal Plain Tidal Marsh Systems,Herb,Riparian,Atlantic Coastal Marsh,SRM 806: Gulf Coast Salt Marsh,Herbaceous / Nonvascular-dominated,Herbaceous - grassland,Perennial graminoid grassland,825
High Allegheny Wetland,Tr Central Interior and Appalachian Swamp Systems,Tree,Riparian,Atlantic Swamp Forests,SAF 61: River Birch-Sycamore,Tree-dominated,Open tree canopy,Mixed evergreen-deciduous open tree canopy,5203
